id,title,authors,journal,year,source
2058,brain pathology identification using computer aided diagnostic tool: a systematic review,"gudigar a., raghavendra u., hegde a., kalyani m., ciaccio e.j., rajendra acharya u.",computer methods and programs in biomedicine,2020,scopus
2088,classification of evoked responses to inverted faces reveals both spatial and temporal cortical response abnormalities in autism spectrum disorder,"nunes a.s., mamashli f., kozhemiako n., khan s., mcguiggan n.m., losh a., joseph r.m., ahveninen j., doesburg s.m., hämäläinen m.s., kenet t.",neuroimage: clinical,2021,scopus
2096,developing brain abnormality recognize system using multi-objective pattern producing neural network,"sridhar k.p., baskar s., shakeel p.m., dhulipala v.r.s.",journal of ambient intelligence and humanized computing,2019,scopus
2156,a new learning and classification framework for the detection of abnormal heart sound signals using hybrid signal processing and neural networks,"zeng w., lin z., yuan c., wang q., liu f., wang y.","chinese control conference, ccc",2020,scopus
2170,from physiology to pathology of cortico-thalamo-cortical oscillations: astroglia as a target for further research,"gobbo d., scheller a., kirchhoff f.",frontiers in neurology,2021,scopus
2192,high-resolution deep transferred asppu-net for nuclei segmentation of histopathology images,"chanchal ak, lal s, kini j.",int j comput assist radiol surg,2021,pubmed
2195,automated detection of abnormal heart sound signals using fano-factor constrained tunable quality wavelet transform,"sawant n.k., patidar s., nesaragi n., acharya u.r.",biocybernetics and biomedical engineering,2021,scopus
2216,pattern detection model using a deep learning algorithm for power data analysis in abnormal conditions,"lee j.-h., kang j., shim w., chung h.-s., sung t.-e.",electronics (switzerland),2020,scopus
2281,abnormality of functional connections in the resting state brains of schizophrenics,"zhu y, zhu g, li b, yang y, zheng x, xu q, li x.",front hum neurosci,2022,pubmed
2291,hybrid fuzzy integrated convolutional neural network (hficnn) for similarity feature recognition problem in abnormal netflow detection,"yue x., wang j., huang w.",neurocomputing,2020,scopus
2306,reduced features set neural network approach based on high-resolution time-frequency images for cardiac abnormality detection,"shafi i., aziz a., din s., ashraf i.",computers in biology and medicine,2022,scopus
2340,computer aided hierarchal lesion classification for diabetic retinopathy abnormalities,"bhardwaj c., jain s., sood m.",international journal of recent technology and engineering,2019,scopus
2400,automated detection of kidney abnormalities using multi-feature fusion convolutional neural networks,"wu y., yi z.",knowledge-based systems,2020,scopus
2461,performance evaluation of machine learning algorithms for detecting abnormal data traffic in computer networks,"uzun b., balli s.","5th international conference on computer science and engineering, ubmk 2020",2020,scopus
